title,company,location,salary,description,experience,employment_type,schedule,working_hours,work_format,published_date,link,skills,salary_range,published_date_dt
Финансовый директор,ТОО ADM Company,Алматы,Не указано,"Компания, занимающуюся железнодорожной логистикой с собственным парком вагонов (оперирование и экспедирование) находится в поиске финансового директора.

Обязанности:

Ведение финансового учета (управленческого и бухгалтерского), консолидация и анализ данных, визуализация отчетности

Бюджетирование, план-фактный анализ бюджета, ежеквартальный финансовый мониторинг, оперативное планирование денежных потоков

Разработка финансово-экономической модели новых проектов, плановой калькуляции себестоимости, финансовых показателей окупаемости проекта, составление бизнес-планов

Налоговое администрирование, оптимизация налогообложения и расходов компании

Работа с финансовыми институтами, привлечение финансирования. Субсидирование

Взаимодействие с оценочными и страховыми компаниями

Требования:

Высшее экономическое/финансовое образование
Опыт работы финансовым директором не менее 3 лет в сфере ЖД логистики
Знание НК РК в части экспедирования и перевозок
Желательно знание Power BI

Условия:

Заработная плата обсуждается на собеседовании, в зависимости от квалификации и зарплатных ожиданий кандидата

Комфортный офис в центре города, в районе парка 28 Панфиловцев

График: 5/2 (выходные - сб, вск), с 08.00 до 17.00

Комплексные обеды за счет компании",3–6 лет,Полная занятость,График: 5/2,8,На месте работодателя,16 мая 2025,https://hh.kz/vacancy/117971322,Не указано,Не указано,2025-05-16
Product Management with AI (Tech Orda Voucher) Trainee,"ТОО Epam Kazakhstan (Эпам Казахстан),ТОО",Алматы,Не указано,"Start your journey in IT with EPAM's industry experts! The training cost is fully covered by the Tech Orda program voucher worth 400,000 tenge, with partial funding provided by EPAM.

To get into the program, you need to undergo a preliminary competitive selection process.

The Product Management with AI program will equip you with practical skills to manage a product throughout its entire lifecycle — from identifying user needs to launching it on the market and scaling it further.

Requirements:

Knowledge of English B2+ (Upper intermediate).

Soft Skills: Solid communicator, humble leader, and team player eager to learn.

Meet the requirements of Tech Orda (epa.ms/2wVDN)

Uploaded self-presentation video.

Uploaded CV.

What you will gain from this program:

Understand the fundamentals of product management – explore key concepts, product lifecycle stages, and the responsibilities of a product manager.

Learn to communicate product ideas effectively – use storytelling techniques to align stakeholders and pitch your vision to internal teams and users.

Master the discovery phase – conduct user research, create personas, build customer journey maps, and perform strategic and competitive analysis.

Develop product positioning and strategy – define product vision, scope, and roadmap tailored to different markets and user segments.

Apply pricing and monetization techniques – select pricing models, analyze competitors, and shape your product’s value proposition.

Manage product development processes – define MVP, write product requirements, prioritize the backlog, and collaborate using Agile frameworks.

Plan and execute successful product launches – design go-to-market strategies, monitor adoption metrics, and implement feedback loops.

Drive long-term product success – select growth tactics, track product maturity, and enhance value through innovation and continuous improvement.

Benefits of our program:

Fundamental knowledge of Product Management. The course covers a wide range of essential topics, ensuring you will understand Product Management practices holistically.

Best engineering practices. You will practice and apply skills that meet up-to-date industrial standards alongside EPAM's leading experts.

Hands-on experience. We emphasize practical learning by providing hands-on exercises and real-world scenarios.",не требуется,Частичная занятость,График: 5/2,2 или 3,Удалённо,15 мая 2025,https://hh.kz/vacancy/120596000,Не указано,Не указано,2025-05-15
Senior Business Analyst,ООО Kanda CA,Алматы,Не указано,"Kanda is looking for a really strong Senior business analyst with AI experience.

! Fluent English (Advanced level) is must have !

+5 years of experience

Looking for a BA who was on at least one AI project before since this is pure AI development the BA will need to understand how to ask proper questions and document the work correctly.

Responsibilities:

Gather and analyze data for potential business expansion

Identify specific business opportunities

Influence stakeholders to support business projects

Assist with project management for selected projects

Coordinate with different departmental teams to produce better business outcomes

Test business processes and recommend improvements

Convert roadmap features into smaller user stories

Write clear and well-structured business requirements/documents

Identify automation opportunities

Create reports, dashboards, and visualizations to understand business performance

Analyze process issues and bottlenecks and to make improvements

Communicate and validate requirements with relevant stakeholders

Develop and maintain reporting tools

Perform data discovery, analysis, and modeling

Collaborate with product manager on roadmap planning and prioritization

Requirements:

Previous experience with Life Sciences is a big plus.

Great analytical, critical thinking and problem-solving abilities
Superior presentation and negotiation skills
Strong management and organizational skills
Adaptable and capable of working in fast-paced environments
Bachelor’s degree or higher in business analysis, business administration, finance or related field",более 6 лет,"Полная занятость
Возможно временное оформление",График: 5/2,8,Не указано,15 мая 2025,https://hh.kz/vacancy/120425067,Не указано,Не указано,2025-05-15
Монтажник,ТОО Коркем Телеком,Макате (атырауская область),"от 190 000 ₸ за месяц, на руки","С кем вы будете работать?

Sergek Group – это профессионалы из разных сфер: разработка ПО, искусственный интеллект, компьютерное зрение, системная аналитика, проектный и продуктовый менеджмент, монтаж оборудовании, финансы, HR, PR и многое другое.

В нашу команду требуется монтажник, готовый к интересной и ответственной работе на объектах автоматизированных пунктов контроля (АПК). Если вы умеете работать с электроинструментом, читать схемы и хотите развиваться в технической сфере — мы ждем вас!
Обязанности:
Планово-профилактические работы на АПК
Монтаж/юстировка антенн, видеокамер, лидаров, RFID
Демонтаж и замена оборудования, работа с архивом
Заявки на закуп, списание и получение материалов
Устранение неисправностей и аварий
Контроль состояния инструмента
Текущее техобслуживание участков
Требования:
Чтение схем, знание электромонтажа и СКС
Опыт работы с инструментом
Командная работа, ответственность, внимательность
Готовность к командировкам
Квалификация:
Средне-специальное или высшее профессиональное образование (желательно по направлениям электрика, механика).

Опыт работы от 1 года.

Что мы предлагаем:
• работа в стабильной компании
• предварительный инструктаж
• карьерный рост
• экстра day offs, помимо отпускных
• материальную помощь к отпуску, а также к памятным событиям",1–3 года,Частичная занятость,Не указано,Не указано,На месте работодателя или разъездной,16 мая 2025,https://hh.kz/vacancy/120613824,Не указано,от 190000 ₸,2025-05-16
CMO/Директор по маркетингу iGaming,ООО PARSEC,Алматы,Не указано,"Parsec — Мы динамично развивающаяся узбекская IT-компания, специализирующаяся на разработке программного обеспечения, создании инфраструктуры данных, аналитике и визуализации данных. Мы помогаем компаниям реализовывать смелые IT-идеи, предоставляя инновационные и масштабируемые решения, адаптированные под индивидуальные потребности клиентов.

О проекте
Мы запускаем новый iGaming‑продукт на локальном рынке. Ваша задача будет выходить за рамки стандартного привлечения трафика — предстоит активно участвовать в формировании маркетинговой стратегии, разработке требований и построении системы аналитики с самого начала совместно с продакт- и технической командой.

Обязанности:

• Создание стратегий для продвижения продукции и услуг компании.

• Анализ рынка — изучение тенденций, потребностей потребителей, конкурентной среды.

• Бюджетирование и планирование — составление бюджета на маркетинговые мероприятия и контроль его исполнения.

• Цифровой маркетинг — развитие интернет-маркетинга (SEO, SMM, контекстная реклама, email-маркетинг).

• Реклама и PR — создание рекламных кампаний, участие в PR-мероприятиях, сотрудничество с агентствами.

• Координация работы с другими отделами — взаимодействие с продажами, продуктовой командой, IT-отделом и другими для достижения общих целей.

• Отчётность и аналитика — подготовка регулярных отчетов о результатах маркетинговых активностей.

Требования:

• Опыт работы с digital marketing, а также в традиционных каналах рекламы.

• Отличные аналитические навыки и умение работать с данными.

• Лидерские качества, умение эффективно управлять командой.

• Знание английского языка на уровне для ведения деловой переписки (если это необходимо для компании).

• Креативность, стратегическое мышление и инициативность. Опыт работы с digital marketing, а также в традиционных каналах рекламы.

• Отличные аналитические навыки и умение работать с данными.

• Лидерские качества, умение эффективно управлять командой.

• Креативность, стратегическое мышление и инициативность.

Условия работы:

• ​​​​​​​Оформление: официальное трудоустройство по ТКРуз, конкурентоспособная заработная плата (обсуждается по итогам собеседования).

• График: пятидневная рабочая неделя с 9.00-18.00.

• Команда: разнопрофильные специалисты, динамичная и дружелюбная среда, открытая к инновациям.",3–6 лет,Полная занятость,График: 5/2,8,Не указано,15 мая 2025,https://hh.kz/vacancy/119767672,Не указано,Не указано,2025-05-15
Android Development with AI Tools (Tech Orda Voucher) Trainee,"ТОО Epam Kazakhstan (Эпам Казахстан),ТОО",Караганда,Не указано,"Details

To get into the program, you need to undergo a preliminary competitive selection process.

The Android Development program is designed to prepare you for a career as an Android Developer. You will master Java and Kotlin and learn to create modern mobile applications for the Android platform.

During the program, you will:

Design intuitive and user-friendly mobile interfaces using modern UI development practices.
Work with APIs and manage local data to enable networking and efficient data storage in apps.
Use popular Android libraries like Android Jetpack and Dagger2, Koin to streamline development and enhance app functionality.

By the end of the program, you’ll be able to confidently apply your knowledge and build fully functional Android applications.

What you will gain from this program:

Write and execute Java programs – build a strong foundation in Java programming.
Master Kotlin – learn a modern language designed for seamless integration with Java.
Develop user-friendly interfaces – design and implement intuitive UIs, work with network requests, and manage local data storage.
Enhance your development with AI – gain expertise in Prompt Engineering and integrate AI tools into Android app development.
Build a real-world Android application – apply your knowledge by creating a capstone project, working on real-life tasks to showcase your skills.

Why choose this program?

Professional Mentorship. You will have group online sessions with a mentor twice a week and individual sessions once every two weeks. During these meetings, you’ll be able to ask questions, receive feedback on your assignments, and gain a deeper understanding of the learning material.
Hands-on Learning with Real Projects. You will gain practical experience by solving real projects-based tasks and engaging hands-on learning, preparing you for technical interviews and helping you build a strong skill set to excel in the fast-paced world of technology.
Simplified Learning Approach. We simplify complex things and boil sophisticated concepts into digestible, bite-sized content without sacrificing quality and learning experience.
Career Support & Job Readiness. We will provide you with all the necessary tools to prepare for your dream job, from resume creation to technical assessments and project defenses, ensuring you are ready for real-life interview situations.

What is required for training:

Intermediate (B1 or higher) English.
Meeting requirements of Tech Orda",не требуется,"Частичная занятость
Стажировка",График: свободный,2 или 3,Удалённо,15 мая 2025,https://hh.kz/vacancy/120580792,Не указано,Не указано,2025-05-15
QA-специалист,ТОО Ломбард Деньги населению,Костанай,Не указано,"«Деньги Маркет» является лидером среди Ломбардов и микрокредитования, не имеющая аналогов на рынке Казахстана , объединив в себе 2 направления - предоставление краткосрочных микрокредитов без залога и под залог золотых изделий, цифровой техники, автомобилей.

Мы помогаем людям в решении финансовых проблем и постоянно улучшаем качество обслуживания.

Вы готовы сделать следующий серьезный шаг в своей карьере?

Откликайтесь и становитесь частью Золотой, Технически подкованной команды!

Мы предлагаем кандидату:

Стабильную заработную плату;
Ежегодный отпуск сроком 24 календарных дня;
Социальный пакет;
Дружелюбную атмосферу;
Работу, в стабильной компании международного уровня;
Стабильную заработную плату, дважды в месяц: оклад + авансы;
Корпоративное обучение и поддержка опытными сотрудниками компании;
Широкие возможности для профессионального развития и карьерного роста;
Корпоративные мероприятия и систему поощрения активных сотрудников;
Дружный коллектив профессионалов.

Обязанности:

Проведение функционального тестирования продуктов, сайтов и мобильных приложений компании перед выкатом на продакшн.

Проверка логики работы функционала, тестирование различных сценариев использования.

Взаимодействие с разработчиками, аналитиками и другими сотрудниками компании для выявления, воспроизведения и фиксации ошибок.

Участие в разработке тест-кейсов и чек-листов для тестирования.

Документирование выявленных багов, передача их в работу разработчикам и контроль исправления.

Проведение регрессионного тестирования после внесения изменений:

Разработка чек-листов для пост-релизной настройки и тестирования

Проведение тестирования после выката изменений в продакшен.

Уведомление заинтересованных сотрудников об изменениях в связи с релизом

Полное регрессионное тестирование системы для предотвращения скрытых багов.

Требования:

Обязательные:

Опыт работы QA-специалистом от 1 года.

Умение тестировать CRM, веб-сайты и мобильные приложения.

Знание основ тестирования: виды тестирования, тест-дизайн, методы работы с баг-трекинговыми системами (JIRA, Trello, Asana и др.).

Навыки составления тест-кейсов, чек-листов и тест-планов.

Внимательность к деталям, системное мышление, ответственность, дисциплинированность.

Умение работать в команде и эффективно взаимодействовать с другими специалистами.

Желательные:

Опыт API-тестирования (Postman, Swagger).

Базовые знания SQL для проверки данных в БД.

Опыт работы в продуктовой компании.

Если ты внимательный к деталям, любишь находить ошибки и хочешь сделать продукты лучше — присоединяйся к нашей команде!

Условия:

График работы: 5/2, с 07:00 до 16:00 (по московскому времени).

Возможность удаленного формата работы.

Конкурентная заработная плата (обсуждается индивидуально на первом этапе общения с кандидатом).

Работа в динамичной продуктовой команде с возможностью влиять на качество и стабильность продуктов компании.

Перспективы профессионального роста и обучения за счет компании",1–3 года,Полная занятость,График: 5/2,8,Не указано,15 мая 2025,https://hh.kz/vacancy/120416247,Не указано,Не указано,2025-05-15
