title,company,location,salary,description,experience,employment_type,schedule,working_hours,work_format,published_date,link,skills,salary_range,published_date_dt
Бизнес-аналитик (Финансовый аналитик),ТОО Hyundai Auto Kazakhstan,Алматы,Не указано,"Hyundai Auto Kazakhstan (официальный дистрибьютор Hyundai в Казахстане) ищет Бизнес-аналитика в команду

Просим внимательно читать наши условия и требования, ЗП указана к начислению (т.е. до вычета налогов), офис находится в МЕГЕ-2.

Обязанности:

Составление финансового анализа;
Сбор и консолидация информации для финансового анализа и отчетности;
Расчет, анализ контроль финансовых данных.
Требования:
Высшее образование экономическое или финансовое;
Знание программы EXCEL на уровне продвинутого пользователя;
Знание основ составление финансовой отчетности, формы и порядок финансовых расчетов;
Опыт работы на аналогичной должности не менее 3-5 лет (обязательно);
Аналитический склад ума
Условия:
График работы 5х2 (с 9:00 до 18:00);
Испытательный срок 3 месяца;
Современный просторный офис в Mega Alma-Ata;
Мед страховка;
Пенсионные отчисления;
Частичная оплата абонемента на спорт.",3–6 лет,Полная занятость,График: 5/2,8,На месте работодателя,15 мая 2025,https://hh.kz/vacancy/120589683,Не указано,Не указано,2025-05-15
"Deep Learning Engineer / LLM, VLM, NLP",Частная компания Retail Robotics Solutions - R&D Ltd.,Астана,Не указано,"About Us:

Retail Robotic Solutions (RRS) stands at the forefront of innovation, merging cutting-edge artificial intelligence (AI) with the dynamic needs of the catering industry. As pioneers in this space, our mission is to transform catering operations globally by making them more efficient, faster, and profoundly cost-effective. Our AI-driven solutions are unrivaled in their recognition capabilities and operational enhancements, setting a new benchmark for excellence in the industry.

At RRS, we don't just innovate; we redefine what's possible, delivering significant cost savings and unparalleled efficiency that set a new industry standard. Our success is evidenced by our strong and growing presence in the European market. As we prepare to expand into the USA market, our commitment to revolutionizing the catering industry remains unwavering.

Proudly affiliated with French Tech and Station F, we operate from their renowned campus, surrounded by a thriving ecosystem of innovation and entrepreneurship. Join us at RRS, where we are not just leading the industry—we are shaping its future.

---------------------------------

Job Summary:

We are looking for a Deep Learning Engineer to work with Vision-Language Models (VLMs). Your core mission will be to design, train, and optimize multimodal AI systems using parameter-efficient fine-tuning (PEFT) and Supervised Fine-Tuning (SFT). You’ll handle end-to-end development: from building Docker-based training pipelines on Google Vertex AI to deploying models into production. This role is ideal for those passionate about cutting-edge AI and solving challenges at the intersection of computer vision and natural language processing.

---------------------------------

Key Responsibilities:

Model Training:

Training and adapting Vision-Language Models (VLM) using LoRA and PEFT (Parameter-Efficient Fine-Tuning).

Experience with transformers, TRL, PEFT and langchain libraries

Implementing Supervised Fine-Tuning (SFT) to enhance model performance on domain-specific datasets.

Configuring and managing training pipelines in Google Vertex AI (distributed GPU training, experiment tracking).

Setting tasks for our inner labeling team

Performance Optimization: Continuously improve the performance of deployed models, optimizing for speed and accuracy.

Collaboration: Collaborate with software engineers to integrate computer vision models into end-user applications.

Research: Stay up-to-date with the latest research and advancements in AI. Apply new techniques and methodologies to improve existing solutions.

Documentation: Create comprehensive documentation for developed models and algorithms, ensuring knowledge transfer and ease of maintenance.

Problem-Solving: Participate in brainstorming sessions and contribute ideas to project planning.

---------------------------------

Skills and Qualifications:

Education: Bachelor’s degree in the technical field. A Master’s degree or relevant certifications is a plus.

Experience:

summarily 2 or more years of experience in LLM, VLM or CV, with a proven track record of developing and deploying neural networks. Internships, pet projects and applicable courses are counted.

adapting large models (ViT, CLIP, GPT) via LoRA and PEFT (e.g., Hugging Face libraries).

Technical Skills:

Proficiency in Python;

Experience with transformers, TRL and PEFT and langchain libraries;

Knowledge of model deployment frameworks such as ONNX (onnx runtime), TensorRT;

Experience with Google Cloud Platform(Vertex AI.Pipelines) for training NN is a big plus

Familiarity with computer vision libraries such as OpenCV, scikit-image is a plus.

Basic familiarity with MLOps practices for model monitoring is a plus.

Experience with multimodal datasets (text + images) is a big plus.

Mathematical and Analytical Skills:

Deep applied understanding of linear algebra, mathematical analysis, probability theory, statistics, and mathematical optimization related to Deep Learning.

Soft Skills:

Strong problem-solving and analytical skills;

Ability to work independently;

Willingness to learn and adapt to new technologies and methods.

Language:

English (Professional working proficiency).

---------------------------------

Compensation and Benefits:

Competitive salary.

Access to Vertex AI infrastructure (GPU A100/V100) and dedicated resources.

Professional development opportunities, including conferences and courses.

Fully remote work + flexible hours.

Opportunity to work on cutting-edge technology with a talented and dynamic team.

Relocation to France is negotiable.

---------------------------------

Application Process:

Interested candidates should submit their resume together with motivation letter (optional). If you pass the initial resume screening, you will be invited to two interviews to test your technical skills and alignment with the company's mindset.",1–3 года,"Полная занятость
Возможно временное оформление",График: 5/2,8,Удалённо,15 мая 2025,https://hh.kz/vacancy/120597570,Не указано,Не указано,2025-05-15
Junior / Middle Data Engineer,Kaspi.kz,Алматы,Не указано,"Мы Kaspi.kz - крупнейшая технологическая компания в Казахстане, миссия которой - улучшать людям жизнь. Ежемесячно нашим супер приложением пользуются более 14 млн казахстанцев

Работа в головном офисе города Алматы.
Удаленку не рассматриваем.

Обязанности:

Работа с бизнес-требованиями заказчиков;

Разработка отчетности и витрин данных;

Построение моделей отчетов;

Анализ логики бизнес-процессов;
Извлечение бизнес-ценностей из данных;
Глубокое погружение в бизнес проблематику кейсов, детальное и предметное обсуждение задач, гипотез и подходов совместно с коллегами и бизнес-заказчиками;
Построение сводных таблиц, графиков и диаграмм в Qlik Sense на основе витрин с детальными данными
Постановка задач для разработки витрин с детальными данными для BI инструментов
Участие в тестировании и решении инцидентов;

Требования:

Коммерческий опыт работы от 1 года и выше;

Опыт работы с БД

Понимание структуры и архитектуры Oracle БД.

Уверенное знание SQL, оптимизация запросов;

Понимание принципов нормализации и денормализации данных.

Написание PL/SQL процедур и функций;

Понимание архитектуры BI-решений, опыт построения витрин данных и ETL-процессов

Опыт работы с Qlik Sense:написание скриптов загрузки данных; построение интерактивных визуализаций и dashboards; использование переменных, set analysis, master items.

Опыт работы с Python: обработка данных (pandas, numpy); автоматизация ETL-процессов или интеграций; разработка вспомогательных скриптов (например, для выгрузки/подготовки данных).

Навыки интеграции Python-скриптов с Qlik или внешними BI/аналитическими сервисами.

Личные качества: аналитическое мышление, умение разбираться в бизнес-требованиях и доносить технические решения, готовность к командной работе и открытость к обратной связи.

Условия:
Развитие и карьерный рост;
Возможность стать частью профессиональной дружной команды Kaspi;
Офис в центре города (г. Алматы, Абая 26а);
Обучение, тренинги и курсы за счет компании;
Бесплатный тренажерный зал в офисе;
Языковые курсы;
Электронная библиотека - Kaspi Books и доступное приложение к нему;
Chill-зона - уютный дворик, workout-площадка, также удобные скамейки и качели, для полной релаксации :)
Отсутствие дресс-кода.",1–3 года,Полная занятость,График: 5/2,8,На месте работодателя,15 мая 2025,https://hh.kz/vacancy/120584874,Не указано,Не указано,2025-05-15
Директор по маркетингу (товарный бизнес),Рекрутинговое агентство CHANGE (ИП Куприянова),Алматы,"от 800 000 ₸ за месяц, на руки","ABIROY GROUP — один из лидеров в сфере промышленных систем водоподготовки в Казахстане. С 2011 года мы развиваем технически сложный и устойчивый бизнес, представляем на рынке международные бренды Ecosoft и Dow Chemical Corporation и работаем с крупнейшими клиентами страны.

Мы ищем сильного руководителя маркетинга, который станет драйвером роста компании через выстроенную с нуля стратегию, эффективное управление командой и точные маркетинговые решения.


Что предлагаем:

Руководящая роль в компании с устойчивым и масштабируемым бизнесом

Участие в принятии ключевых решений по развитию компании

Оклад: от 800 000 ₸ на руки, после испытательного срока-возможны проценты от выручки

Бонус за выполнение стратегических задач

Бонус от выручки — при достижении значимого влияния на бизнес-результаты

Полный рабочий день в офисе, график 5/2


Что предстоит:

Разработать и внедрить маркетинговую стратегию, опираясь на амбиции бизнеса

Сформировать и контролировать всю воронку маркетинга: от узнаваемости до привлечения лидов

Управлять аутсорс-командой и подрядчиками: подбирать, ставить задачи, добиваться результата

Повышать узнаваемость бренда и усиливать его позицию на рынке

Отвечать за аналитику, бюджеты, эффективность каждого вложенного тенге

Взаимодействовать с ключевыми подразделениями компании

Участвовать в продвижении социальных и экологических инициатив бренда


Кого мы ищем:

Руководителя с опытом в товарном бизнесе (не услуги), с пониманием, как маркетинг влияет на выручку

Человека с опытом в маркетинге от 5 лет, который умеет строить систему, а не подменять собой исполнителей

Сильного управленца, способного работать через команду и подрядчиков

Стратегически мыслящего профессионала с высокой самостоятельностью

Владение Excel, CRM, BI, digital-аналитикой — обязательны

Если вы чувствуете, что готовы взять под контроль рост бренда и отвечать за результат — ждём ваше резюме.
Здесь будет не только работа, но и влияние.",3–6 лет,Полная занятость,График: 5/2,8,На месте работодателя,15 мая 2025,https://hh.kz/vacancy/120588338,Не указано,от 800000 ₸,2025-05-15
"Персональный менеджер, отделение Оркен (Сайрамский район, село Карабулак)",АО Микрофинансовая организация KMF(КМФ),Аксукенте,Не указано,"Компания KMF – лидер на рынке микрофинансирования с большими планами на будущее. Мы открыли более 116 офисов, получили множество наград и активно принимаем участие в важных для экономики Казахстана событиях. Поддерживаем «зеленые технологии», спорт, предпринимательство и т.д.

Персональный менеджер – это ключевое звено, лицо Компании, движущая сила, и мы ищем сотрудника в нашу команду. Персональный менеджер – это ответственность, амбициозность и коммуникабельность. Благодаря этим качествам вы сможете многого добиться и значительно повысить свои доходы.


Что делать?
• Консультировать клиентов на всех этапах сотрудничества;
• Вести и увеличивать клиентскую базу;
• Проводить финансовый анализ бизнеса клиентов.",не требуется,Полная занятость,Не указано,Не указано,Не указано,15 мая 2025,https://hh.kz/vacancy/120592528,Не указано,Не указано,2025-05-15
Главный бухгалтер,ТОО GLAMOUR NAILS,Алматы,Не указано,"Обязанности:

Ведение управленческого учета;
Контроль за ведением бухгалтерского, налогового учета;
Контроль сдачи налоговой и статистической отчетности;
Формирование налоговой и учетной политики с разработкой по ее реализации;
Налоговое планирование, оптимизация налоговой нагрузки;
Контроль начисления заработной платы и налогообложения;
Контроль материалов для услуг (поступление, списание ТМЦ), контроль калькуляции, корректировка калькуляции, оценка доходности услуг, анализ затрат на услуги и акции;
Контроль проведения и результатов инвентаризаций;
Оптимизация товарных остатков;
Анализ реализации услуг, доходность услуг, предложения по увеличению выручки;
Бюджетное планирование, оптимизация расходов.
Контроль за оформлением таможенных документов, начисление цен с учетом таможенных и других затрат.
Требования:

Опыт работы от 6 лет и более на аналогичной должности,

Знание программ: 1С 8.3. ;

Знание ВЭД;

Опыт работы с большим объемом информации, постановки технических задач программисту;

Аналитический склад ума.

Условия:
График работы 5/2, с 8.00-17.00
Трудоустройство в соответствии с законодательством РК
Офис в центре города",более 6 лет,Полная занятость,График: 5/2,8,Не указано,15 мая 2025,https://hh.kz/vacancy/120590664,Не указано,Не указано,2025-05-15
Аналитик данных,ТОО Magnum E-commerce Kazakhstan,Алматы,Не указано,"Крупнейший в Казахстане Онлайн-супермаркет MagnumGO, являющийся частью Kaspi.kz, приглашает в свою команду профессионалов и предлагает возможность присоединиться в управление по инжинирингу данных. Мы обрабатываем данные в batch- и realtime-контурах и предоставляем необходимую информацию различным сервисам и командам аналитиков. От нашей работы зависит качество продуктовых и бизнес-решений, эффективность команд.

Какие задачи вас ждут:

Создание витрин и дашбордов, работа с документацией
Ваша роль будет включать сбор и анализ требований для создания витрин данных и дашбордов, описание потоков данных, бизнес-процессов и алгоритмов работы во внутренних системах, а также поддержку документации по сущностям и витринам хранилища данных.
Проведение расчётов и консультирование пользователей
Вы займётесь созданием ad-hoc-расчётов для новых витрин данных, а также будете проверять качество данных в уже существующих витринах, консультировать внутренних пользователей по вопросам работы с данными хранилища, проверять новые требования к витринам хранилища на согласованность с уже существующими, находить противоречия, предлагать решения в спорных ситуациях.

Мы ждем, что вы:

Хорошо знаете SQL;
Умеете выявлять, структурировать, описывать требования бизнес-пользователей и систематизировать много информации;
Работали и участвовали в проектах по развитию хранилищ данных в роли аналитика не менее одного года;
Описывали процессы с использованием схем, UML-диаграмм и других графических инструментов;
Понимаете принципы построения ETL-процессов в крупных организациях.

Условия:

Современный офис в Алматы со всем необходимым для комфортной работы и отдыха, есть парковка;
Достойный совокупный доход на уровне рынка и выше;
Культура открытости и взаимопомощи: у нас работают люди, вовлеченные в процесс и не безразличные к тому, что они делают;
Высокая скорость работы и возможность быстро увидеть свой вклад и результаты работы;
Работа в технологической компании с возможностью создавать сервисы, полезные миллионам людей.",1–3 года,Полная занятость,График: 5/2,8,Не указано,15 мая 2025,https://hh.kz/vacancy/120590140,Не указано,Не указано,2025-05-15
Аналитик по внутренней отчетности,ТОО Аврора Холдинг,Алматы,Не указано,"Обязанности:

Формирование еженедельных и ежемесячных отчетов по продажам в Power BI;

Ведение ежедневной отчетности по приходам и расходам;

Расчет бонусной части заработной платы торгового персонала;

Разработка и автоматизация отчетности в Power BI;

Сбор и предоставление аналитической информации для руководства;

Проверка актов выполненных работ (АВР).

Требования:

Продвинутый уровень владения MS Excel и Power BI, Power Query;

Опыт подготовки аналитической отчетности;

Внимательность, аналитическое мышление, умение работать с большими объемами данных.

Условия:

Стабильная и своевременная выплата заработной платы;

Возможности для профессионального и личностного роста;

Пятидневная рабочая неделя;

Официальное трудоустройство в соответствии с ТК.",1–3 года,Полная занятость,График: 5/2,8,Не указано,15 мая 2025,https://hh.kz/vacancy/120574017,Не указано,Не указано,2025-05-15
