title,company,location,salary,description,experience,employment_type,schedule,working_hours,work_format,published_date,link,skills
Финансист,ТОО ТОРГОВЫЙ ДОМ ТЭМ-КАЗАХСТАН,Вакансия опубликована 18 мая 2025 в Астане,"от 300 до 350 000 ₸ за месяц, на руки","Мы являемся ведущим поставщиком стальных труб в Казахстане. Наши филиалы охватывают крупнейшие города страны. В связи с расширением фин.отдела, мы ищем ответственного и исполнительного Финансиста для обеспечения эффективного управления финансовыми операциями компании:

Обязанности:

Ведение платежных поручений и контроль платежей;
Подготовка финансовой отчетности для руководства;
Анализ и контроль исполнения бюджета;
Взаимодействие с банками и финансовыми учреждениями;
Контроль за валютными операциями и сопровождение сделок;

Требования:

Высшее образование: Финансы/Экономика;
Опыт работы в банковской сфере от 2 лет;
Знание систем финансового учета и отчетности;
Опыт работы с платежными поручениями;
Уверенное владение MS Office и 1С;
Аналитический склад ума, ответственность и внимательность к деталям.
Условия:
Официальное трудоустройство и своевременная оплата труда;
График работы: 5/2 с 08:00 до 17:00;
Современный комфортный офис с удобным расположением;
Перспективы карьерного роста;
Дружный коллектив, любящий свое дело.

Если вы готовы принять участие в управлении финансовыми процессами компании и обеспечении ее стабильного роста, отправляйте свое резюме. Будем рады обсудить возможности сотрудничества!",1–3 года,Полная занятость,График: 5/2,Рабочие часы: 8,Не указано,18 мая 2025,https://hh.kz/vacancy/120367134,"Финансовая отчетность,Финансовый анализ,Платежные поручения,Бюджетирование"
Экономист-аналитик,ТОО Казэнергоинвест,Вакансия опубликована 18 мая 2025 в Астане,"от 450 000 ₸ за месяц, на руки","Обязанности:
Разработка форм и составление бюджета по проектам;
Работа с финансовыми институтами по привлечению денежных средств (кредитные линий, лизинг техники),
Выпуск гарантий по исполнению обязательств;
Составление управленческой отчетности и анализ финансово-хозяйственной деятельности;
Формирование и реализация финансовых и производственных планов (бюджетов - БДР, БДДС);
Контроль и оценка эффективности работы на местах путем сравнения фактических данных с плановыми показателями.
Требования:
Опыт работы более 5 лет;
Владение 1С-Бухгалтерия, опытный пользователь Microsoft Office - Excel, Word, PowerPoint
Условия:
Официальное трудоустройство согласно ТК РК
Конкурентная, стабильная, своевременная заработная плата
Долгосрочные отношения
Бонусы по результатам года
Комфортный, современный офис на левом берегу столицы
Приятные ""плюшки"" от компании (подарки ко дню рождения, корпоративы, тимбилдинги)
Возможности для обучения и профессионального роста
Трудовой отпуск 24 календарных дня.",более 6 лет,Полная занятость,График: 5/2,Рабочие часы: 8,Формат работы: на месте работодателя,18 мая 2025,https://hh.kz/vacancy/120407078,"Основы финансового менеджмента,Бюджетирование,Финансовый анализ,Финансовое планирование,Экономический анализ,Формирование аналитической отчетности,MS Excel,1С: Предприятие 8,Финансовая стратегия,Бюджетирование ФОТ,Планирование бюджета"
Контент-менеджер,ИП Imperial-ritual.kz,Вакансия опубликована 18 мая 2025 в Алматы,"от 300 000 до 500 000 ₸ за месяц, на руки","О компании:

Мы — сервис в сфере ритуальных услуг, активно развивающийся в регионах Казахстана. У нас уже есть сайт, присутствие в поиске, картах и рекламных платформах. Ищем внимательного, самостоятельного и ответственного специалиста, который сможет взять под контроль контент и его эффективность на всех ключевых площадках.


Обязанности:

Работа с сайтом:

Добавление новых городов и услуг через CMS;

Наполнение страниц текстами и изображениями по ТЗ;

Актуализация контента (замена, корректировка, удаление устаревших данных).

Анализ и улучшение контента:

Оценка эффективности страниц (по данным из Яндекс.Метрики, Google Analytics и другим системам);

Подготовка предложений по замене или улучшению контента;

Проведение простых A/B тестов: заголовки, изображения, тексты.

Площадки объявлений (OLX и аналоги):

Публикация и обновление объявлений;

Ведение учёта и контроль за эффективностью объявлений (просмотры, обращения);

Оптимизация текстов и заголовков объявлений.

Карты и локальные площадки (Google, Яндекс, 2GIS, Gizguard):

Постоянное обновление информации о компании;

Публикация новостей, фото, информации об услугах;

Мониторинг отзывов и активности.

Требования:

Опыт работы с CMS (желательно OctoberCMS, WordPress или аналог);

Умение работать с Google Analytics / Яндекс.Метрика (базовая аналитика);

Опыт работы с OLX, Google Мой Бизнес, Яндекс Карты, 2GIS;

Грамотный письменный русский язык;

Умение писать или редактировать тексты под задачи бизнеса;

Самостоятельность и навык работы в режиме многозадачности.",3–6 лет,Полная занятость,График: 5/2,Рабочие часы: 9,Формат работы: на месте работодателя или гибрид,18 мая 2025,https://hh.kz/vacancy/120580626,"Контентные метрики,Контентная стратегия,Маркетинговые метрики,Крауд-маркетинг,Контент-маркетинг,Публикация контента"
Бухгалтер по налогам,ТОО TapTatti Retail,Вакансия опубликована 18 мая 2025 в Астане,"от 400 000 до 600 000 ₸ за месяц, на руки","Обязанности:

Ведение налогового учета компании;
Сбор ФНО 100.00, 101.04, 300.00, 701.01, 700.00, 851.00, 870.00, 328.00 (при необходимости). Сверка между декларациями;
Проверка налогов группы компаний поквартально;
Тесная переписка с налоговыми органами;
Сбор некоторых форм стат.отчетности.

Требования:

Опыт работы на аналогичной позиции не менее 3-х лет;
Отличные знания Налогового кодекса;

Условия:

График работы 5/2
Оформление по ТК РК.
Бесплатный обед",3–6 лет,Полная занятость,График: 5/2,Рабочие часы: 8,Формат работы: на месте работодателя,18 мая 2025,https://hh.kz/vacancy/120101824,"Бухгалтерский учет,Расчет доплат,Оптимизация налогообложения,Основы налогового учета,Расчет затрат,Учет отпусков,1С: Зарплата и кадры,Бухгалтерский аудит,Статистическая отчетность,Отчет о движении денежных средств,Финансовый контроль,1С: Зарплата и управление персоналом,Налоговое планирование,Расчет оплаты простоя,Финансовая отчетность,Умение работать в коллективе,Исполнительность,Налоговая отчетность,Налог на прибыль,1С: Предприятие 8,Бухгалтерская отчетность,1С: Документооборот,1С: Бухгалтерия,Электронный документооборот,Контроль кредиторской задолженности,Расчет налогов,Финансовый анализ,Управление бухгалтерией,Главбух,Платежные поручения,Английский — A1 — Начальный"
Бизнес аналитик,ТОО TECHDRIVE,Вакансия опубликована 18 мая 2025 в Алматы,Не указано,"Вакансия: Бизнес аналитик

О компании TechDrive:

Мы TechDrive – инновационная технологическая компания, специализирующаяся на Разработке передовых IT-решений для бизнеса, создании цифровых продуктов, автоматизации процессов в FinTech решении. Мы являемся лидерами в сфере автокредитования. Наша миссия – Быть драйвером роста продаж автокредитов наших партнеров, объединяя лучшие финансовые практики и передовые технологии.

О роли Бизнес аналитика:

Мы ищем талантливого и проактивного Бизнес аналитика, который станет ключевым звеном между нашими клиентами/бизнес-заказчиками и командой разработки. Вам предстоит глубоко анализировать потребности, выявлять проблемы и возможности, а также формализовывать требования для создания высококачественных и ценных программных продуктов. Если вы умеете видеть картину целиком, мыслить системно и эффективно коммуницировать, мы ждем вас!

Чем вы будете заниматься:

Сбор, анализ, структурирование и формализация бизнес-требований от стейкхолдеров (клиентов, руководителей, конечных пользователей).

Проведение интервью, воркшопов, опросов и других мероприятий для выявления потребностей и определения объема работ.

Описание и моделирование бизнес-процессов (с использованием BPMN, UML или других нотаций).

Разработка и ведение необходимой документации: спецификации, технические задания, user stories, user cases, регламенты.

Взаимодействие с командами разработки, тестирования и управления проектами на всех стадиях жизненного цикла продукта.

Анализ данных для выявления закономерностей, проблем и обоснования решений.

Участие в планировании, оценке сроков и ресурсов проектов.

Поддержка команды тестирования, участие в функциональном и приемном тестировании.

Анализ и оптимизация существующих бизнес-процессов.

Проактивное предложение решений, улучшающих продукты и процессы.

Наши ожидания:

Опыт работы Бизнес аналитиком от 2-3 лет.

Уверенное владение техниками сбора и анализа требований.

Опыт работы с инструментами управления требованиями и задачами (Jira, Confluence, Trello).

Знание и понимание основных методологий разработки ПО (Agile, Scrum, Kanban).

Опыт моделирования бизнес-процессов (знание BPMN будет существенным плюсом).

Сильные аналитические способности, умение работать с большим объемом информации и выявлять главное.

Отличные коммуникативные навыки, умение эффективно взаимодействовать с разными типами стейкхолдеров.

Умение четко и грамотно излагать мысли устно и письменно.

Внимательность к деталям, системное мышление, ответственность.

Будет плюсом:

Опыт работы в FinTech, E-commerce.

Знание основ SQL.

Опыт работы с API (понимание принципов, умение работать с инструментами типа Postman).

Понимание основ UX/UI дизайна.

Наличие профильных сертификатов (например, CBAP, CCBA).

Техническое образование или бэкграунд.

Что мы предлагаем:

Конкурентную заработную плату, обсуждаемую по результатам собеседования.

Официальное трудоустройство согласно законодательству РК.

Возможности для профессионального и карьерного роста в быстрорастущей компании.

Интересные и масштабные проекты, где можно применить свои знания и приобрести новый опыт.

Работа в команде высококвалифицированных и увлеченных своим делом профессионалов.

Офис в Алматы.

Компенсация на выбор: обучения, спорт, здоровье, питание.

Мы ждем вас в TechDrive!",3–6 лет,Полная занятость,График: 5/2,Рабочие часы: 8,Формат работы: на месте работодателя,18 мая 2025,https://hh.kz/vacancy/119768146,"Бизнес-анализ,Аналитическое мышление,SQL,Разработка бизнес-требований,Разработка технических заданий,Подготовка макетов,User Story,Figma,Приемочное тестирование,Узбекский — B1 — Средний,Немецкий — A1 — Начальный,Английский — B2 — Средне-продвинутый"
Интегратор Битрикс24,ТОО CleverCRM,Вакансия опубликована 17 мая 2025 в Алматы,Не указано,"Город: Алматы / Астана / удалённая работа

Занятость: Полная занятость

Зарплата: от 300,000 до 500,000 KZT (обсуждается на собеседовании, зависит от опыта)

О компании:

Мы - динамично развивающаяся IT-компания, специализирующаяся на внедрении и настройке CRM-систем для бизнеса. Наша миссия - помогать компаниям оптимизировать процессы и достигать новых высот с помощью современных технологий. Присоединяйтесь к нашей команде профессионалов, чтобы вместе создавать эффективные решения для клиентов!

Обязанности:

- Настройка и внедрение Битрикс24 (CRM, бизнес-процессы, корпоративный портал) под задачи клиентов.

- Интеграция Битрикс24 со сторонними системами (1С, телефония, мессенджеры, сайты) через API.

- Анализ бизнес-процессов клиентов, разработка и внедрение оптимальных решений на базе Битрикс24.

- Обучение пользователей и подготовка документации по настройке системы.

- Техническая поддержка и доработка функционала порталов Битрикс24.

- Участие в командных проектах по автоматизации процессов.

Требования:

- Опыт работы с Битрикс24 (настройка CRM, порталов, бизнес-процессов) от 1 года.

- Знание принципов работы API и опыт интеграции систем.

- Базовые навыки программирования (PHP, JavaScript) и работы с базами данных (MySQL).

- Понимание бизнес-процессов и умение предлагать решения для их оптимизации.

- Коммуникабельность, умение работать в команде и эффективно взаимодействовать с клиентами.

- Желательно: опыт работы с другими CRM (AmoCRM, Salesforce и др.), сертификаты Битрикс24.

- Знание казахского и/или русского языков, английский будет преимуществом.

Условия:

- Гибкий график работы

- Удалённая работа

- Доступ к внутреннему и внешнему обучению, участие в сертификациях Битрикс24.

- Возможности карьерного роста до руководителя проектов или бизнес-аналитика.

Почему стоит работать у нас?

- Интересные проекты для крупных клиентов из разных индустрий.

- Возможность влиять на результат и предлагать свои идеи.",1–3 года,"Полная занятость
Возможно временное оформление",График: 5/2,Рабочие часы: 8,Формат работы: удалённо,17 мая 2025,https://hh.kz/vacancy/120249634,"Битрикс24,1С-Битрикс,Автоматизация бизнес-процессов,Описание бизнес-процессов,Оптимизация бизнес-процессов,Анализ бизнес-процессов,Регламентация бизнес-процессов,IP-телефония,PHP"
Бренд-менеджер,ТОО Stella Kazakhstan,Вакансия опубликована 18 мая 2025 в Алматы,"от 400 000 ₸ за месяц, на руки","Обязанности:

Формирование и реализация стратегии корпоративных продаж

Развитие продуктового предложения под B2B

Управление командой менеджеров по продажам

Развитие ключевых партнёрств и личные продажи крупным клиентам

Планирование и управление показателями

Работа с CRM и аналитикой

Сотрудничество с другими отделами

Повышение узнаваемости компании в корпоративном сегменте

Оптимизация процессов и автоматизация

Финансовая ответственность за B2B-направление

Направление B2C. Сбор и планирование заказов

Анализ продаж бутиков

Разработка новых продуктов под бутики

Контент и визуальная коммуникация

Цифровой маркетинг и активные продажи

Контроль за интернет-магазином и ассортиментом

Требования:

Опыт работы в розничных и корпоративных продажах товаров в сфере домашнего текстиля и аксессуаров
Владение Английским языком не ниже уровня Intermediate
Владение Excel
Умение работать с электронными базами данных
Условия:
Работа в компании - лидере индустрии
Взаимодействие с люксовыми брендами
Возможности для профессионального роста",3–6 лет,Полная занятость,График: 5/2,Рабочие часы: 8,Формат работы: на месте работодателя или разъездной,18 мая 2025,https://hh.kz/vacancy/120279425,"MS Excel,Английский язык,Контроль и анализ ценообразования,Анализ ассортиментной линейки,Английский язык (Intermediate)"
